{
  "schema_version": "1.0.0",
  "specimen_id": "enamel_live_001",
  "units": {
    "length": "um",
    "angle": "deg",
    "stress": "MPa"
  },
  "provenance": {
    "source_paths": {
      "som": "microct_pipeline/som_approach/output_som_morphometrics/morphometrics.json",
      "hsb": "microct_pipeline/output_hsb_roi/piv_stats.csv",
      "piv": "microct_pipeline/output_piv/track_centerlines_piv.parquet",
      "tracking": "microct_pipeline/output_tracking_100/instantaneous_angles.csv",
      "validation": "microct_pipeline/output_validation_100/slices",
      "smoothed3d": "microct_pipeline/output_3d_v2"
    },
    "source_hashes": {
      "som": "66304abc8dae6ff29d8c4920cf032f6276891d8b286a216f79ddc2593ca13a97",
      "hsb": "df150609a9c35bdfe156e8e3d5a3b3d483fa5b3d16f78cc8fb8dd880f3cf24eb",
      "piv": "eb60afc3689f79457310073b132bb974ffb1ab2ed91edde2ca3a91aa17945117",
      "tracking": "ccdefee0d5f302925d0d26bb362e888d44c3f31c1fe283b49659ef2125e5dc21",
      "validation": "15f7ace22e9a00334f25cf09bd5730407ef6b4f0c6ad78a9ef5bae07ad42eda5",
      "smoothed3d": "16445f04e818d0df1ae8d483cbf7cb09da0d30348e192227f12f545b7b307f71"
    },
    "ingestion_timestamp_iso": "2026-04-14T06:18:03.594038+00:00",
    "coordinate_frame": {
      "z_origin": "DEJ+10um",
      "z_axis": "+into_enamel",
      "xy_units": "um",
      "z_units": "um"
    },
    "pipeline_version": "0.1.0",
    "scale_clamps": []
  },
  "depth_profiles": {
    "depth_um": [
      10.0,
      10.345,
      10.69,
      11.035,
      11.379999999999999,
      11.725,
      12.07,
      12.415,
      12.76,
      13.105,
      13.45,
      13.795,
      14.14,
      14.485,
      14.83,
      15.175,
      15.52,
      15.864999999999998,
      16.21,
      16.555,
      16.9,
      17.244999999999997,
      17.59,
      17.935,
      18.28,
      18.625,
      18.97,
      19.314999999999998,
      19.66,
      20.005,
      20.35,
      20.695,
      21.04,
      21.384999999999998,
      21.729999999999997,
      22.075,
      22.419999999999998,
      22.765,
      23.11,
      23.455,
      23.799999999999997,
      24.145,
      24.49,
      24.835,
      25.18,
      25.525,
      25.869999999999997,
      26.215,
      26.56,
      26.904999999999998,
      27.25,
      27.595,
      27.939999999999998,
      28.285,
      28.63,
      28.974999999999998,
      29.32,
      29.665,
      30.009999999999998,
      30.354999999999997,
      30.7,
      31.044999999999998,
      31.389999999999997,
      31.735,
      32.08,
      32.425,
      32.769999999999996,
      33.114999999999995,
      33.459999999999994,
      33.805,
      34.15,
      34.495,
      34.839999999999996,
      35.185,
      35.53,
      35.875,
      36.22,
      36.565,
      36.91,
      37.254999999999995,
      37.599999999999994,
      37.94499999999999,
      38.29,
      38.635,
      38.98,
      39.325,
      39.67,
      40.015,
      40.36,
      40.705,
      41.05,
      41.394999999999996,
      41.739999999999995,
      42.085,
      42.43,
      42.775,
      43.12,
      43.464999999999996,
      43.809999999999995,
      44.154999999999994,
      44.5
    ],
    "pitch_signed_deg": [
      -1.0930608458914655,
      -1.0930608458914655,
      -1.0930608458914655,
      -1.096983601618711,
      -1.1044379561211792,
      -1.1118923106236478,
      -1.1193466651261164,
      -1.126801019628585,
      -1.1177152063953617,
      -1.0965884831155435,
      -1.0754617598357252,
      -1.054335036555907,
      -1.0332083132760885,
      -1.0867026988987285,
      -1.1837999856159225,
      -1.2808972723331165,
      -1.37799455905031,
      -1.4750918457675033,
      -1.4424853631543828,
      -1.3498623026521972,
      -1.2572392421500116,
      -1.164616181647826,
      -1.0719931211456395,
      -1.059321146257135,
      -1.0753079052042298,
      -1.0912946641513246,
      -1.1072814230984194,
      -1.1232681820455142,
      -1.2046467938435983,
      -1.303554484231577,
      -1.4024621746195565,
      -1.5013698650075353,
      -1.600277555395514,
      -1.577789167156874,
      -1.5323630337771024,
      -1.48693690039733,
      -1.4415107670175584,
      -1.3960846336377861,
      -1.5277559896745023,
      -1.680524770945925,
      -1.8332935522173477,
      -1.986062333488772,
      -2.138831114760195,
      -2.323807819790939,
      -2.510622105216914,
      -2.6974363906428884,
      -2.8842506760688633,
      -3.0710649614948395,
      -2.7609536275350837,
      -2.45009547278167,
      -2.1392373180282527,
      -1.828379163274839,
      -1.5459178488216816,
      -1.792155515613372,
      -2.03839318240506,
      -2.284630849196748,
      -2.5308685159884385,
      -2.720291556205186,
      -2.4173123176111515,
      -2.1143330790171166,
      -1.811353840423079,
      -1.508374601829044,
      -1.291549715772651,
      -1.5411245234486832,
      -1.790699331124713,
      -2.0402741388007426,
      -2.289848946476772,
      -2.489897342630585,
      -2.5018144047765327,
      -2.5137314669224806,
      -2.525648529068428,
      -2.537565591214376,
      -2.5005823903455497,
      -2.3250469342339986,
      -2.149511478122451,
      -1.9739760220109033,
      -1.7984405658993559,
      -1.6712615913856899,
      -1.6500515154494972,
      -1.6288414395133046,
      -1.6076313635771118,
      -1.5864212876409192,
      -1.572121317315148,
      -1.5698008748671393,
      -1.5674804324191307,
      -1.565159989971122,
      -1.5628395475231134,
      -1.5353571182852295,
      -1.4728820272692633,
      -1.410406936253297,
      -1.3479318452373308,
      -1.2854567542213646,
      -1.233093438565286,
      -1.1920979417458781,
      -1.151102444926471,
      -1.110106948107064,
      -1.0691114512876567,
      -1.049566255987682,
      -1.049566255987682,
      -1.049566255987682,
      -1.049566255987682
    ],
    "pitch_abs_deg": [
      42.05707249511446,
      42.05707249511446,
      42.05707249511446,
      41.97345703511552,
      41.81456381716928,
      41.65567059922303,
      41.496777381276786,
      41.33788416333054,
      41.183019440119224,
      41.031087380197754,
      40.87915532027628,
      40.72722326035481,
      40.57529120043335,
      40.41025425059815,
      40.23755979972649,
      40.06486534885482,
      39.89217089798316,
      39.7194764471115,
      39.6597692874782,
      39.65234365058008,
      39.64491801368196,
      39.63749237678385,
      39.63006673988573,
      39.54588671228935,
      39.4341938168332,
      39.32250092137705,
      39.2108080259209,
      39.09911513046474,
      39.10430017103204,
      39.14081575870354,
      39.17733134637505,
      39.21384693404655,
      39.25036252171806,
      39.19487763379693,
      39.12200928929399,
      39.049140944791056,
      38.97627260028812,
      38.90340425578518,
      38.89153036987531,
      38.886922685390076,
      38.88231500090484,
      38.87770731641961,
      38.87309963193437,
      38.93849312917234,
      39.007880451039895,
      39.07726777290745,
      39.146655094775,
      39.21604241664255,
      39.07893922898395,
      38.94152571036194,
      38.80411219173992,
      38.66669867311791,
      38.540576956318404,
      38.624688633687256,
      38.7088003110561,
      38.792911988424954,
      38.87702366579381,
      38.963468560670776,
      39.07013503733436,
      39.176801513997944,
      39.28346799066153,
      39.39013446732511,
      39.45154508228541,
      39.26796145822821,
      39.08437783417099,
      38.90079421011379,
      38.71721058605658,
      38.58812105387288,
      38.666033117092745,
      38.7439451803126,
      38.82185724353246,
      38.89976930675232,
      38.9864030295539,
      39.09774839049414,
      39.20909375143438,
      39.32043911237462,
      39.43178447331486,
      39.493905540412456,
      39.448155976120105,
      39.402406411827755,
      39.356656847535405,
      39.310907283243054,
      39.351741720177486,
      39.54268029660584,
      39.73361887303419,
      39.92455744946254,
      40.11549602589089,
      40.292812721997066,
      40.451185530449365,
      40.60955833890167,
      40.76793114735398,
      40.92630395580628,
      40.96054098772864,
      40.855222603463666,
      40.7499042191987,
      40.64458583493372,
      40.53926745066875,
      40.48905538961716,
      40.48905538961716,
      40.48905538961716,
      40.48905538961716
    ],
    "yaw_signed_deg": [
      -3.440586072280313,
      -3.440586072280313,
      -3.440586072280313,
      -3.4062150716961495,
      -3.3409003692844275,
      -3.275585666872705,
      -3.2102709644609826,
      -3.14495626204926,
      -2.99391682781937,
      -2.7804715098593134,
      -2.5670261918992576,
      -2.353580873939201,
      -2.1401355559791444,
      -2.1700068228150315,
      -2.3420537975379485,
      -2.514100772260866,
      -2.6861477469837824,
      -2.8581947217066985,
      -2.871496106992369,
      -2.8113426722508508,
      -2.751189237509333,
      -2.691035802767815,
      -2.6308823680262967,
      -2.6368440880572375,
      -2.666505006273915,
      -2.696165924490592,
      -2.725826842707269,
      -2.7554877609239457,
      -2.759732047341711,
      -2.7571630976013144,
      -2.754594147860918,
      -2.7520251981205215,
      -2.749456248380125,
      -2.7573654293634426,
      -2.7672544493565137,
      -2.777143469349585,
      -2.787032489342656,
      -2.796921509335727,
      -2.8614932442986243,
      -2.932579269749252,
      -3.003665295199879,
      -3.074751320650507,
      -3.145837346101134,
      -3.123044250196374,
      -3.09489500546894,
      -3.066745760741506,
      -3.038596516014072,
      -3.0104472712866372,
      -3.007663927317488,
      -3.0049187053154847,
      -3.0021734833134808,
      -2.9994282613114773,
      -2.996747763735774,
      -2.9952723205916394,
      -2.9937968774475054,
      -2.9923214343033715,
      -2.9908459911592375,